<mapping name="Sync CIO display to AIC defocus" xmlns="http://www.multi-access.de" xmlns:xsi="http://www.w3.org/2001/XMLSchema-instance"
         xsi:schemaLocation="http://www.multi-access.de mint-mappings.xsd">
  <operator type="sequential" id="1">
    <observations>
      <observation id="2" interactor="Interactor.CIO" states="displayed" result="cio" process="onchange"/>
      <observation id="3" type="negation" interactor="Interactor.AIO" name="cio.name" states="defocused" result="aio" process="instant"/>
      <observation id="5" interactor="Interactor.CIO" name="cio.name" states="displayed" process="instant"/>
    </observations>
    <actions>
      <event id="4" type="defocus" target="aio"/>
    </actions>
  </operator>
</mapping>
