<?xml version='1.0'?>
<mim name="Default Sync Mappings" xmlns="http://www.multi-access.de"
     xmlns:xsi="http://www.w3.org/2001/XMLSchema-instance"
     xsi:schemaLocation="http://www.multi-access.de mint-mappings.xsd">

  <include href="browserscreen_reload_to_cio_hidden_refresh.xml" start="true" />
  <include href="browserscreen_reload_to_cio_displaying_refresh.xml" start="true" />
  <include href="mouse_stop_to_cio_highlight.xml" start="true" />
  <include href="mouse_press_to_aicommand_activate.xml" start="true" />
  <include href="mouse_release_to_aicommand_deactivate.xml" start="true" />
  <!--include href="aicommand_activate_to_button_press.xml" start="true" />
  <include href="aicommand_deactivate_to_button_release.xml" start="true" /-->
  <include href="aio_defocus_to_cio_unhighlight.xml" start="true" />
  <include href="aio_focus_to_cio_highlight.xml" start="true" />
  <include href="aio_present_to_cio_display.xml" start="true" />
  <include href="aio_suspend_to_cio_hide.xml" start="true" />
  <include href="button_press_to_aicommand_activate.xml" start="true" />
  <include href="button_release_to_aicommand_deactivate.xml" start="true" />
  <include href="left_button_aisinglepresence_enter.xml" start="true"/>

  <!--include href="cio_display_to_aio_defocus.xml" start="true" />
  <include href="cio_display_to_aio_present.xml" start="true" />
  <include href="cio_hide_to_aio_suspend.xml" start="true" />
  <include href="cio_highlight_to_aio_focus.xml" start="true" /-->
  <include href="cio_hide_to_cio_display_cache_remove.xml" start="true" />
  <include href="cio_display_to_cio_display_cache_add.xml" start="true" />
  <include href="aisinglepresence_present_to_child_present.xml" start="true" />
  <include href="aisinglepresence_children_finished_to_caroufredsel_init_js.xml" start="true" />
  <include href="aisinglechoice_present_to_child_present.xml" start="true" />
  <include href="aisinglechoiceelement_unchosen_to_radiobutton_unselect.xml" start="true" />
  <include href="aisinglechoiceelement_chosen_to_radiobutton_select.xml" start="true" />
  <include href="radiobutton_unselected_to_aisinglechoiceelement_unchoose.xml" start="true" />
  <include href="radiobutton_selected_to_aisinglechoiceelement_choose.xml" start="true" />
  <include href="mouse_press_to_aisinglechoiceelement_choose.xml" start="true" />
  <!--include href="mouse_press_to_aisinglechoiceelement_unchoose.xml" start="true" /-->
  <include href="head_tilting_right_to_aisinglepresence_next.xml" start="true"/>
  <include href="head_tilting_left_to_aisinglepresence_prev.xml" start="true"/>
  <include href="head_looking_right_to_aisinglepresence_next.xml" start="true"/>
  <include href="head_looking_left_to_aisinglepresence_prev.xml" start="true"/>
  <include href="head_nodding_to_aisinglepresence_next.xml" start="true"/>

  <!-- Gesture-based Navigation -->
  <include href="onehandposnav_previous_to_aio_prev.xml" start="true"/>
  <include href="onehandposnav_next_to_aio_next.xml" start="true"/>
  <include href="onehandposnav_confirm_to_aichoiceelement_choose.xml" start="true"/>

  <!-- browser refresh handling -->
  <include href="caroufredsel_refreshing_to_caroufredsel_init_js.xml" start="true"/>
</mim>

        

