<mapping name="AISingleChoice present to present active child" xmlns="http://www.multi-access.de" xmlns:xsi="http://www.w3.org/2001/XMLSchema-instance"
         xsi:schemaLocation="http://www.multi-access.de mint-mappings.xsd">
  <operator type="sequential" id="1">
    <observations>
      <observation id="2" interactor="Interactor.AIO.AIOUT.AIContainer.AISingleChoice" states="presenting" result="aisc" process="onchange"/>
      <observation id="3" type="negation" interactor="Interactor.AIO" name="aisc.children.first.name" states="presenting" result="active_child" process="instant"/>
    </observations>
    <actions>
      <backend id="5" call="present_children" class="AUIControl" parameter="aisc"/>
      <event id="6" type="children_finished" target="aisc"/>
    </actions>
  </operator>
</mapping>

