<mapping name="Sync Mouse press to AISingleChoiceElement unchoose" xmlns="http://www.multi-access.de"
         xmlns:xsi="http://www.w3.org/2001/XMLSchema-instance"
         xsi:schemaLocation="http://www.multi-access.de mint-mappings.xsd">

  <operator type="sequential" id="1">
    <observations>
      <observation id="2" interactor="Interactor.IR.IRMode.Pointer.Mouse" states="left_pressed" result="m" process="onchange"/>
      <observation id="3" interactor="Interactor.AIO.AIIN.AIINDiscrete.AIReference.AIChoiceElement.AISingleChoiceElement" states="focused" result="sce" process="instant"/>
      <observation id="4" interactor="Interactor.AIO.AIIN.AIINDiscrete.AIReference.AIChoiceElement.AISingleChoiceElement" name="sce.name" result ="ttt" states="chosen" process="instant"/>
    </observations>
    <actions>
      <event id="5" type="unchoose" target="sce"/>
    </actions>
  </operator>

</mapping>

