<mapping name="Sync CIO highlight to AIO focused" xmlns="http://www.multi-access.de" xmlns:xsi="http://www.w3.org/2001/XMLSchema-instance"
         xsi:schemaLocation="http://www.multi-access.de mint-mappings.xsd">
  <operator type="sequential" id="1">
    <observations>
      <observation id="2" interactor="Interactor.CIO" states="highlighted" result="cio" process="onchange"/>
      <observation id="3" type="negation" interactor="Interactor.AIO" name="cio.name" states="focused" result="cio" process="instant"/>
      <observation id="5" interactor="Interactor.CIO" states="highlighted" name="cio.name" process="instant"/>
    </observations>
    <actions>
      <event id="4" type="focus" target="cio"/>
    </actions>
  </operator>
</mapping>
