<mapping name="Sync AIO focus to CIO highlight" xmlns="http://www.multi-access.de" xmlns:xsi="http://www.w3.org/2001/XMLSchema-instance"
         xsi:schemaLocation="http://www.multi-access.de mint-mappings.xsd">
  <operator type="sequential" id="1">
    <observations>
      <observation id="2" interactor="Interactor.AIO" states="focused" result="aio" process="onchange"/>
      <observation id="3" type="negation" interactor="Interactor.CIO" name="aio.name" states="highlighted" result="cio" process="instant"/>
      <observation id="5" interactor="Interactor.AIO" states="focused" name="aio.name"  process="instant"/>
    </observations>
    <actions>
      <event id="4" type="highlight" target="cio"/>
    </actions>
  </operator>
</mapping>

